{
  "version": 1,
  "day_seconds": 600,
  "scan_seconds": 60,
  "heat_gain": 0.09,
  "heat_cool": 0.04,
  "scoop_rate": 0.35,
  "heat_damage": 12,
  "event_percent": 160,
  "mission_days": 8,
  "mission_reward": 350,
  "fine": 200,
  "trade_percent": 15,
  "rank": [
    0,
    8,
    16,
    32,
    64,
    128,
    512,
    2560,
    6400
  ]
}
